{
  "record_type": "packet_transition",
  "schema_version": "0.1.0",
  "record_version": "1.0.0",
  "transition_id": "CAL-TRANSITION-004",
  "event_model": "append_only",
  "event_kind": "state_transition",
  "from_packet_ref": {
    "packet_id": "CAL-PACKET-001",
    "record_version": "1.3.0",
    "hashes": [
      {
        "algorithm": "sha256",
        "digest": "1288c636347affbafaa6d78b9bd67f337cb2b9c3f3ec2103225f73c7506ef0b7"
      }
    ]
  },
  "to_packet_ref": {
    "packet_id": "CAL-PACKET-001",
    "record_version": "1.4.0",
    "hashes": [
      {
        "algorithm": "sha256",
        "digest": "88a75826fc3f9c6606b3ec99ec989996b1f4c0b9e377d84249cd22b3ecdf7d9e"
      }
    ]
  },
  "sequence": 4,
  "from_status": "in_progress",
  "to_status": "submitted",
  "actor_id": "CAL-CONTRIBUTOR-001",
  "occurred_at": "2026-08-07T17:40:00Z",
  "git_commit": "3fd7a29560e78ac3ecaa131707b61727c25ae9fd",
  "reason": "The exact proof artifact and producing run record were complete and submitted for independent calibration review.",
  "next_owner_id": "CAL-REVIEWER-001",
  "evidence_refs": [
    {
      "artifact_id": "CAL-EVIDENCE-001",
      "record_version": "1.0.0",
      "hashes": [
        {
          "algorithm": "sha256",
          "digest": "a9a864d1a2dbc8b5348762398d74b9a3960fc77eec6d783bf92ff4d53d465abf"
        }
      ]
    }
  ],
  "submission_boundary": {
    "private_by_default": true,
    "schema_fields_are_public_allowlist": true,
    "allowlisted_artifact_ids": [
      "CAL-EVIDENCE-001"
    ],
    "excluded_from_submission_by_default": {
      "raw_transcript": true,
      "prompt_history": true,
      "chain_of_thought": true,
      "private_notes": true,
      "unpublished_communications": true,
      "personal_context": true,
      "credentials": true,
      "unrelated_local_files": true
    },
    "raw_interaction_records_required": false,
    "redaction_status": "passed",
    "publication_preview_status": "approved",
    "retention_rule": "approved_submission_only"
  },
  "submission_rights": {
    "commons_originated_record": true,
    "dedication": "CC0-1.0",
    "dedication_scope": "intentionally_submitted_commons_components_only",
    "submitted_component_ids": [
      "CAL-TRANSITION-004",
      "CAL-EVIDENCE-001"
    ],
    "third_party_rights_preserved": true,
    "third_party_source_ids": [],
    "redistribution_status": "permitted"
  },
  "limitations": {
    "status": "known",
    "items": [
      "This append-only event documents a synthetic known-result calibration history, not open-problem progress."
    ]
  }
}
